{
  "id": "triceps_medial_head",
  "display_name": "Triceps Brachii (Medial Head)",
  "group": "arms",
  "synergists": [
    "triceps_brachii",
    "triceps_brachii_long_head",
    "triceps_lateral_head"
  ],
  "antagonists": [
    "biceps_brachii"
  ],
  "weekly_volume_landmarks": {
    "mev": {
      "min_sets": 2,
      "max_sets": 3,
      "description": "Active in all triceps work"
    },
    "mav": {
      "min_sets": 3,
      "max_sets": 6,
      "description": "3-6 sets per week"
    },
    "mrv": {
      "min_sets": 8,
      "max_sets": 10,
      "description": "Low volume requirements"
    }
  },
  "recommended_frequency": {
    "min_times_per_week": 2,
    "max_times_per_week": 3
  },
  "recovery_characteristics": {
    "recovery_time_hours": {
      "min": 48,
      "max": 72
    },
    "fatigue_factor": "low",
    "description": "Deep triceps head; active in all triceps movements"
  },
  "recommended_exercises": [
    "triceps_pulldown",
    "triceps_skull_crusher",
    "triceps_overhead_extension"
  ],
  "knowledge_version": "1.0.0",
  "created_at": "",
  "last_updated": "2026-07-02",
  "verified_by": "",
  "references": []
}
