{
  "id": "forearms",
  "display_name": "Forearms (Composite)",
  "group": "forearms",
  "synergists": [],
  "antagonists": [],
  "weekly_volume_landmarks": {
    "mev": {
      "min_sets": 3,
      "max_sets": 4,
      "description": "Composite"
    },
    "mav": {
      "min_sets": 4,
      "max_sets": 8,
      "description": "Composite"
    },
    "mrv": {
      "min_sets": 10,
      "max_sets": 12,
      "description": "Composite"
    }
  },
  "recommended_frequency": {
    "min_times_per_week": 2,
    "max_times_per_week": 3
  },
  "recovery_characteristics": {
    "recovery_time_hours": {
      "min": 48,
      "max": 72
    },
    "fatigue_factor": "low",
    "description": "Composite reference for forearm muscles"
  },
  "recommended_exercises": [],
  "knowledge_version": "1.0.0",
  "created_at": "",
  "last_updated": "2026-07-02",
  "verified_by": "",
  "references": []
}
