{
  "id": "medial_deltoid",
  "display_name": "Medial / Lateral Deltoid",
  "group": "shoulders",
  "synergists": [
    "anterior_deltoid",
    "trapezius"
  ],
  "antagonists": [
    "posterior_deltoid",
    "latissimus_dorsi"
  ],
  "weekly_volume_landmarks": {
    "mev": {
      "min_sets": 4,
      "max_sets": 6,
      "description": "Requires direct lateral raise work for growth"
    },
    "mav": {
      "min_sets": 8,
      "max_sets": 14,
      "description": "Growth at 8-14 sets per week"
    },
    "mrv": {
      "min_sets": 16,
      "max_sets": 20,
      "description": "AC joint can be aggravated beyond 18 sets"
    }
  },
  "recommended_frequency": {
    "min_times_per_week": 2,
    "max_times_per_week": 3
  },
  "recovery_characteristics": {
    "recovery_time_hours": {
      "min": 48,
      "max": 48
    },
    "fatigue_factor": "low",
    "description": "Small muscle; recovers fast. Key to shoulder width aesthetics"
  },
  "recommended_exercises": [
    "shoulders_lateral_raise",
    "shoulders_cable_lateral_raise",
    "shoulders_upright_row"
  ],
  "knowledge_version": "1.0.0",
  "created_at": "",
  "last_updated": "2026-07-02",
  "verified_by": "",
  "references": []
}
